display_name,party_type,tin_display,country_code,transaction_code,email,address_full,buyer_document,buyer_document_number,buyer_idtku,seller_display_name,seller_internal_party_id__do_not_edit,internal_party_id__do_not_edit
PT Silesia Flavours Indonesia,seller,769479395416000,IDN,4,,"JL. DAAN MOGOT KM, 21 PERGUDANGAN ERAPRIMA BLOK H, 18, PORIS GAGA BARU, BATUCEPER, KOTA TANGERANG, BANTEN, 15122",TIN,,,,,8da10eef-ea32-45c5-9b82-febbabbb5658
PT. Daesang Food Indonesia,buyer,10711463057000,IDN,4,,KAWASAN SURYACIPTA CITY OF INDUSTRY JL.SURYA UTAMA Blok 1-25B No.- RT:000 RW:000 Kel.KUTANEGARA Kec.CIAMPEL Kota/Kab.KARAWANG JAWA BARAT 41361,TIN,,,,8da10eef-ea32-45c5-9b82-febbabbb5658,
PT. Dolphin Food & Beverages Industry,buyer,10007524451000,IDN,4,,JL. RAYA INDUSTRI XIII Blok AE 4-7 No.000 RT:000 RW:000 Kel.BUNDER Kec.CIKUPA Kota/Kab.TANGERANG BANTEN 15710,TIN,,,,8da10eef-ea32-45c5-9b82-febbabbb5658,
PT. Actavis Indonesia,buyer,10005254052000,IDN,4,,Jalan Raya Bogor KM.28 Blok - No.- RT:000 RW:000 Kel.Pekayon Kec.Pasar Rebo Kota/Kab.Jakarta Timur DKI Jakarta 13710,TIN,,,,8da10eef-ea32-45c5-9b82-febbabbb5658,
PT. Birotika Semesta,buyer,13107743062000,IDN,4,,"MULIA BUSSINES PARK BLD F, JL. M.T. HARYONO KAV.58-60 Blok - No.- RT:000 RW:000 Kel.Pancoran Kec.Mampang Prapatan Kota/Kab.Jakarta Selatan DKI Jakarta 00000",TIN,,,,8da10eef-ea32-45c5-9b82-febbabbb5658,
PT. Rentokil Indonesia,buyer,10001790058000,IDN,4,,"SOUTH QUARTER TOWER B, LT. 21 JL. R.A KARTINI KAV.8 Blok E-H No.- RT:010 RW:004 Kel.- Kec.- Kota/Kab.JAKARTA SELATAN DKI JAKARTA 00000",TIN,,,,8da10eef-ea32-45c5-9b82-febbabbb5658,
PT. Traktor Nusantara,buyer,13104831092000,IDN,4,,JL. PULOGADUNG Blok - No.32 RT:000 RW:000 Kel.- Kec.CAKUNG Kota/Kab.JAKARTA TIMUR DKI JAKARTA 00000,TIN,,,,8da10eef-ea32-45c5-9b82-febbabbb5658,
PT. Palmas Entraco,buyer,13140660075000,IDN,4,,JL. KH. SAMANHUDI Blok - No.85 RT:008 RW:006 Kel.PASAR BARU Kec.SAWAH BESAR Kota/Kab.JAKARTA PUSAT DKI JAKARTA 00000,TIN,,,,8da10eef-ea32-45c5-9b82-febbabbb5658,
CV. Tangguh Adi Perkasa,buyer,210139358407000,IDN,4,,JL. KH. AGUS SALIM Blok - No.53A RT:004 RW:008 Kel.- Kec.- Kota/Kab.BEKASI JAWA BARAT 00000,TIN,,,,8da10eef-ea32-45c5-9b82-febbabbb5658,
PT. Trustway Transindo,buyer,30484158044000,IDN,4,,"RUKO CENTRAL 88 KEMAYORAN, JL. TREMBESI Blok F No.808 RT:000 RW:000 Kel.PADEMANGAN TIMUR Kec.PADEMANGAN Kota/Kab.JAKARTA UTARA DKI JAKARTA 00000",TIN,,,,8da10eef-ea32-45c5-9b82-febbabbb5658,
PT. Solusindo Corporindo Teknologi,buyer,27472596047000,IDN,4,,JL. KAPUK KAMAL RAYA NO.62E Blok - No.62 RT:000 RW:000 Kel.- Kec.- Kota/Kab.JAKARTA UTARA DKI JAKARTA 14470,TIN,,,,8da10eef-ea32-45c5-9b82-febbabbb5658,
PT. Antaran Sukses Express,buyer,26281469416000,IDN,4,,JL. RADEN FATAH Blok - No.10 RT:001 RW:001 Kel.- Kec.PANINNGILAN UTARA Kota/Kab.TANGERANG TANGERANG 00000,TIN,,,,8da10eef-ea32-45c5-9b82-febbabbb5658,
PT. Konimex,buyer,11312246532000,IDN,4,,Desa Sanggrahan Blok - No.- RT:000 RW:000 Kel.SANGGRAHAN Kec.GROGOL Kota/Kab.SUKOHARJO JAWA TENGAH 57192,TIN,,,,8da10eef-ea32-45c5-9b82-febbabbb5658,
PT. Tri Manggolo Dento,buyer,12032470641000,IDN,4,,JL. RAYA SURABAYA - KRIAN KM 21 Blok - No.- RT:000 RW:000 Kel.TANJUNGSARI Kec.TAMAN Kota/Kab.SIDOARJO JAWA TIMUR 00000,TIN,,,,8da10eef-ea32-45c5-9b82-febbabbb5658,
PT. Santos Jaya Abadi,buyer,12031290092000,IDN,4,,JL. RAYA GILANG Blok - No.159 RT:000 RW:000 Kel.GILANG Kec.TAMAN Kota/Kab.SIDOARJO JAWA TIMUR 00000,TIN,,,,8da10eef-ea32-45c5-9b82-febbabbb5658,
PT. Sarianugerah Semesta,buyer,15668403007000,IDN,4,,"EQUITY TOWER LANTAI 49 UNIT B, C, F, JL JENDERAL SUDIRMAN KAV 52-53 SCBD Blok - No.- RT:000 RW:000 Kel.SENAYAN Kec.KEBAYORAN BARU Kota/Kab.KOTA ADM. JAKARTA SELATAN DKI JAKARTA 12190",TIN,,,,8da10eef-ea32-45c5-9b82-febbabbb5658,
"PT. Telekomunkasi Indonesia, Tbk",buyer,10000131093000,IDN,4,,JAPATI Blok 00 No.1 RT:000 RW:000 Kel.00 Kec.00 Kota/Kab.BANDUNG JAWA BARAT 00000,TIN,,,,8da10eef-ea32-45c5-9b82-febbabbb5658,
PT. Unitech Sukses Mulia,buyer,664616059039000,IDN,4,,Perkantoran Sunrise Garden Blok A2 No.3 RT:002 RW:005 Kel.Kedoya Utara Kec.Kebon Jeruk Kota/Kab.Jakarta Barat DKI Jakarta 11520,TIN,,,,8da10eef-ea32-45c5-9b82-febbabbb5658,
PT. Kimpo Sejahtera,buyer,18705723402000,IDN,4,,JL. KERAMAT I Blok - No.52 RT:001 RW:003 Kel.SUKAJADI Kec.KARAWACI Kota/Kab.TANGERANG BANTEN 15113,TIN,,,,8da10eef-ea32-45c5-9b82-febbabbb5658,
PT. Jasa Angkasa Semesta Tbk,buyer,10653228005000,IDN,4,,MENARA CARDIG LT.3 HALIM PERDNA KUSUMA Blok 0 No.0 RT:011 RW:008 Kel.KEBON PALA Kec.0 Kota/Kab.JAKARTA TIMUR DKI JAKARTA 00000,TIN,,,,8da10eef-ea32-45c5-9b82-febbabbb5658,
PT. Thea Theo Stationary,buyer,664635943416000,IDN,4,,RUKO MODERNLAND Blok AR No.27 RT:000 RW:000 Kel.PORIS PLAWAD INDAH Kec.BATU CEPER Kota/Kab.TANGERANG BANTEN 00000,TIN,,,,8da10eef-ea32-45c5-9b82-febbabbb5658,
CV. Surya Abadi Komputer,buyer,24563041011000,IDN,4,,GD.ITC KUNINGAN JL. PROF DR.SATRIO Blok B1 No.22 RT:000 RW:000 Kel.KUNINGAN Kec.0000 Kota/Kab.JAKARTA SELATAN DKI JAKARTA 00000,TIN,,,,8da10eef-ea32-45c5-9b82-febbabbb5658,
PT. Pancaran Mulia Sejati,buyer,13924576431000,IDN,4,,Jl. Raya Klari Dusun Krajan Blok - No.- RT:000 RW:000 Kel.Klari Kec.Klari Kota/Kab.Karawang Jawa Barat 41371,TIN,,,,8da10eef-ea32-45c5-9b82-febbabbb5658,
PT. Fps Indonesia,buyer,24586760023000,IDN,4,,PRAMUKA RAYA Blok 00 No.165 RT:000 RW:000 Kel.0000 Kec.0000 Kota/Kab.0000 JAKARTA PUSAT 00000,TIN,,,,8da10eef-ea32-45c5-9b82-febbabbb5658,
PT. Pelangi International Logistics,buyer,22389027042000,IDN,4,,BANGKA Blok 000 No.01 RT:000 RW:000 Kel.0000 Kec.0000 Kota/Kab.0000 JAKARTA UTARA 00000,TIN,,,,8da10eef-ea32-45c5-9b82-febbabbb5658,
PT. Niramas Utama,buyer,15093792431000,IDN,4,,"JL.RAYA BEKASI KM.39,5 Blok - No.- RT:000 RW:000 Kel.TAMBUN Kec.TAMBUN SELATAN Kota/Kab.KAB.BEKASI JAWA BARAT 17510",TIN,,,,8da10eef-ea32-45c5-9b82-febbabbb5658,
PT. Landkrone Indo Nutri,buyer,19255611624000,IDN,4,,DUSUN WONOGRIYO Blok - No.- RT:001 RW:001 Kel.SUMBERSUKO Kec.GEMPOL Kota/Kab.PASURUAN JAWA TIMUR 00000,TIN,,,,8da10eef-ea32-45c5-9b82-febbabbb5658,
PT. Cakra Anugerah Perkasa,buyer,27915818044000,IDN,4,,JL.KP BANADN Blok - No.10 RT:000 RW:000 Kel.- Kec.ANCOL Kota/Kab.JAKARTA UTARA DKI JAKARTA 00000,TIN,,,,8da10eef-ea32-45c5-9b82-febbabbb5658,
PT. Moy Dairy And Food Products,buyer,744953258022000,IDN,4,,"GD. SAHID SUDIRMAN CENTER LT. 11 SUITE A, JL. JEND SUDIRMAN Blok - No.86 RT:000 RW:000 Kel.KARET TENGSIN Kec.TANAH ABANG Kota/Kab.JAKARTA PUSAT DKI JAKARTA 00000",TIN,,,,8da10eef-ea32-45c5-9b82-febbabbb5658,
PT. Sumber Sari Mas Industri,buyer,812090041452000,IDN,4,,BIZPOINT MODERN MULTI BUSINESS Blok H No.55 RT:000 RW:000 Kel.SUKA MULYA Kec.CIKUPA Kota/Kab.KAB. TANGERANG BANTEN 00000,TIN,,,,8da10eef-ea32-45c5-9b82-febbabbb5658,
PT. Cargoport Indonesia,buyer,210614962028000,IDN,4,,JL.KH HASYIM ASHARI Blok 00 No.125 RT:000 RW:000 Kel.- Kec.- Kota/Kab.JAKARTA PUSAT DHI JAKARTA 00000,TIN,,,,8da10eef-ea32-45c5-9b82-febbabbb5658,
PT. Cardindo Citrabuana,buyer,16564080415000,IDN,4,,GD.JPT I - CARGO AREA BANDARA S.H. PAJANG Blok 00 No.12P RT:000 RW:000 Kel.- Kec.- Kota/Kab.TANGERANG BANTEN 00000,TIN,,,,8da10eef-ea32-45c5-9b82-febbabbb5658,
PT. Internusa Food,buyer,20390613047000,IDN,4,,KAMAL MUARA RAYA Blok - No.40 RT:004 RW:002 Kel.KAMAL MUARA Kec.PENJARINGAN Kota/Kab.JAKARTA UTARA DKI JAKARTA 14470,TIN,,,,8da10eef-ea32-45c5-9b82-febbabbb5658,
PT. Subur Aryaduta Sukses,buyer,747837763028000,IDN,4,,JL.KH HASYIM ASHARI Blok 000 No.71 RT:003 RW:005 Kel.0000 Kec.0000 Kota/Kab.0000 DKI JAKARTA 00000,TIN,,,,8da10eef-ea32-45c5-9b82-febbabbb5658,
PT. Gaya Sukses Mandiri Kaseindo,buyer,22085773631000,IDN,4,,JL MARGOMULYO Blok 00 No.63A RT:000 RW:000 Kel.000 Kec.GREGES Kota/Kab.SURABAYA JAWA TIMUR 00000,TIN,,,,8da10eef-ea32-45c5-9b82-febbabbb5658,
PT. Pusan Manis Mulia,buyer,13301973451000,IDN,4,,"KP. Pasir Randu, Kadu Blok - No.- RT:000 RW:000 Kel.Kadu Kec.Curug Kota/Kab.Tangerang Banten 00000",TIN,,,,8da10eef-ea32-45c5-9b82-febbabbb5658,
PT. Leschaco Logistic Indonesia,buyer,18852772062000,IDN,4,,"SULTAN ISKANDAR MUDA V-TA, PONDOK PINANG Blok 0 No.0 RT:000 RW:000 Kel.0 Kec.0 Kota/Kab.JAKARTA SELATAN DKI JAKARTA 00000",TIN,,,,8da10eef-ea32-45c5-9b82-febbabbb5658,
PT. Globelink Sea And Air Freight Indonesia,buyer,24757551039000,IDN,4,,ARTERI KEDOYA Blok 0 No.1 RT:010 RW:001 Kel.0 Kec.0 Kota/Kab.JAKARTA BARAT DKI JAKARTA 00000,TIN,,,,8da10eef-ea32-45c5-9b82-febbabbb5658,
PT. Indomarsan Utama Internasional,buyer,13651070042000,IDN,4,,"BUGIS RAYA, KEBON BAWANG Blok 0 No.15 RT:001 RW:001 Kel.0 Kec.0 Kota/Kab.JAKARTA UTARA DKI JAKARTA 00000",TIN,,,,8da10eef-ea32-45c5-9b82-febbabbb5658,
PT. Dakota Buana Semesta,buyer,17619628008000,IDN,4,,"JL.RADIN INTEN , RUKO 150 Blok C2 No.150 RT:008 RW:005 Kel.000 Kec.000 Kota/Kab.JAKARTA TIMUR DKI JAKARTA 00000",TIN,,,,8da10eef-ea32-45c5-9b82-febbabbb5658,
PT. Multi Citra Rasa,buyer,704590355407000,IDN,4,,RUKAN EMERALD COMMERCIAL JL. BULEVARD UF NO.018 Blok - No.- RT:000 RW:000 Kel.MARGA MULYA Kec.BEKASI UTARA Kota/Kab.BEKASI JAWA BARAT 00000,TIN,,,,8da10eef-ea32-45c5-9b82-febbabbb5658,
PT. Perfetti Van Melle Indonesia,buyer,10692010057000,IDN,4,,"Jl. Jakarta Bogor KM 47,5 Blok - No.- RT:000 RW:000 Kel.Mekar Kec.Cibinong Kota/Kab.Bogor Jawa Barat 10912",TIN,,,,8da10eef-ea32-45c5-9b82-febbabbb5658,
PT. Aneka Coffee Industry,buyer,10712750057000,IDN,4,,DESA TROSOBO Blok - No.- RT:002 RW:006 Kel.TROSOBO Kec.TAMAN Kota/Kab.SIDOARJO JAWA TIMUR 61257,TIN,,,,8da10eef-ea32-45c5-9b82-febbabbb5658,
PT. Shipco Transport Indonesia,buyer,18701326058000,IDN,4,,Jln. TB Simatupang Blok - No.5 RT:001 RW:007 Kel.Ragunan Kec.Pasar Minggu Kota/Kab.Jakarta Selatan DKI Jakarta 12550,TIN,,,,8da10eef-ea32-45c5-9b82-febbabbb5658,
PT. Dhl Global Forwarding Indonesia,buyer,19579218058000,IDN,4,,"Bandara Soekarno Hatta, Soewarno Business Park Blok A No.08 RT:000 RW:000 Kel.Pajang Kec.Benda Kota/Kab.Tangerang Banten 15126",TIN,,,,8da10eef-ea32-45c5-9b82-febbabbb5658,
PT. Pelopor Pratama Lancar Abadi,buyer,26838474042000,IDN,4,,Jln. Edam II Blok - No.12 RT:003 RW:016 Kel.Kebon Bawang Kec.Tanjung Priok Kota/Kab.Jakarta Utara DKI Jakarta 14320,TIN,,,,8da10eef-ea32-45c5-9b82-febbabbb5658,
PT. Unindo Niaga Pratama,buyer,15621154002000,IDN,4,,JL. RAYA JATINEGARA TIMUR Blok - No.78 RT:000 RW:000 Kel.BALI MESTER Kec.BALI MESTER Kota/Kab.JAKARTA TIMUR DKI JAKARTA 00000,TIN,,,,8da10eef-ea32-45c5-9b82-febbabbb5658,
"PT. Cisarua Mountain Dairy, Tbk",buyer,24057648431000,IDN,4,,KP BABAKAN RAWAHAUR Blok - No.101 RT:005 RW:005 Kel.SENTUL Kec.BABAKAN MADANG Kota/Kab.BOGOR JAWA BARAT 00000,TIN,,,,8da10eef-ea32-45c5-9b82-febbabbb5658,
PT. Revo Print Indonesia,buyer,746390418453000,IDN,4,,RUKO EMERALD AVENUE 1 Blok EA No.A-23 RT:003 RW:007 Kel.- Kec.- Kota/Kab.TANGERANG SELATAN JAWA BARAT 00000,TIN,,,,8da10eef-ea32-45c5-9b82-febbabbb5658,
CV. Duta Surya,buyer,14293062609000,IDN,4,,Rungkut Industri Blok 3 No.29 RT:000 RW:000 Kel.Rungkut Menanggal Kec.Gunung Anyar Kota/Kab.Surabaya Jawa Timur 60293,TIN,,,,8da10eef-ea32-45c5-9b82-febbabbb5658,
PT. Marizarasa Sarimurni,buyer,13542014038000,IDN,4,,JL. RAYA RANGKASBITUNG KM.08 Blok - No.- RT:000 RW:000 Kel.- Kec.JAWILAN Kota/Kab.SERANG BANTEN 00000,TIN,,,,8da10eef-ea32-45c5-9b82-febbabbb5658,
PT. Global International Express,buyer,31000235034000,IDN,4,,TAMAN PALEM LESTARI RUKO PELANGI Blok B No.18 RT:013 RW:008 Kel.CENGKARENG BARAT Kec.- Kota/Kab.JAKARTA BARAT DKI JAKARTA 00000,TIN,,,,8da10eef-ea32-45c5-9b82-febbabbb5658,
PT. Monarre Makmur Abadi,buyer,26079012451000,IDN,4,,JL. BUMI MAS VII KAWAN INDUSTRI CIKUPA MAS Blok - No.3 RT:000 RW:000 Kel.TALAGA Kec.CIKUPA Kota/Kab.TANGERANG JAWA BARAT 00000,TIN,,,,8da10eef-ea32-45c5-9b82-febbabbb5658,
PT. Mero Sekawan Jaya,buyer,18707455415000,IDN,4,,JL.K.H. E.Z. MUTTAQIEN Blok - No.38 RT:004 RW:002 Kel.GEMBOR Kec.PERIUK Kota/Kab.TANGERANG BANTEN 00000,TIN,,,,8da10eef-ea32-45c5-9b82-febbabbb5658,
PT. X Coffee Indonesia,buyer,26952713043000,IDN,4,,"JL.RAYA SENTUL KM 1,5 Blok 0 No.88 RT:004 RW:002 Kel.CIPAMBUAN Kec.BABAKAN MADANG Kota/Kab.KAB.BOGOR JAWA BARAT 00000",TIN,,,,8da10eef-ea32-45c5-9b82-febbabbb5658,
PT. Golden Power Beverages,buyer,849167309225000,IDN,4,,CAMMO INDUSTRIAL PARK G Blok - No.13 RT:000 RW:000 Kel.BALOI PERMAI Kec.BATAM KOTA Kota/Kab.BATAM KEPULAUAN RIAU 00000,TIN,,,,8da10eef-ea32-45c5-9b82-febbabbb5658,
PT. Harapan Surya Lestari,buyer,26566943436002,IDN,4,,"JL. LANBAU, KP. LIO BARU Blok - No.00 RT:003 RW:003 Kel.- Kec.- Kota/Kab.BOGOR JAWA BARAT 00000",TIN,,,,8da10eef-ea32-45c5-9b82-febbabbb5658,
PT. Esatama Prima Sempurna,buyer,823535844085000,IDN,4,,GREEN SEDAYU BIZ PARK DAAN MOGOT 11 BIZ-C3 Blok - No.21 RT:000 RW:000 Kel.KALIDERES Kec.KALIDERES Kota/Kab.JAKARTA BARAT DKI JAKARTA 00000,TIN,,,,8da10eef-ea32-45c5-9b82-febbabbb5658,
PT. Creasindo Megapratama,buyer,28855930085000,IDN,4,,GREEN SEDAYU BIZPARK DAAN MOGOT I Blok 0000 No.108 RT:000 RW:000 Kel.KALIDERES Kec.KALIDERES Kota/Kab.JAKARTA BARAT DKI JAKARTA 11840,TIN,,,,8da10eef-ea32-45c5-9b82-febbabbb5658,
PT. Puyo Indonesia Kreasi,buyer,709100788411000,IDN,4,,RUKO BSD SEKTOR VII Blok C28 No.31 RT:000 RW:000 Kel.LENGKONG GUDANG Kec.SERPONG Kota/Kab.TANGERANG SELATAN BANTEN 15321,TIN,,,,8da10eef-ea32-45c5-9b82-febbabbb5658,
PT. Union Foods,buyer,11204237415000,IDN,4,,"DESA, JATAKE JATI UWUNG TANGERANG BANTEN Blok 000 No.000 RT:000 RW:000 Kel.JATI UWUNG Kec.JATIUWUNG Kota/Kab.TANGERANG BANTEN 15136",TIN,,,,8da10eef-ea32-45c5-9b82-febbabbb5658,
PT. Integrated Healthcare Indonesia,buyer,32304875063000,IDN,4,,K-LINK TOWER LT. 12 ZONA G JL. GATOT SUBROTO KAV. 59A Blok 000 No.000 RT:000 RW:000 Kel.KUNINGAN TIMUR Kec.SETIABUDI Kota/Kab.JAKARTA SELATAN DKI JAKARTA 12950,TIN,,,,8da10eef-ea32-45c5-9b82-febbabbb5658,
PT. Etos Indonusa,buyer,15962855039000,IDN,4,,"JL DAAN MOGOT KM,21 PERGUDANGAN ERAPRIMA Blok H No.018 RT:000 RW:000 Kel.PORIS GAGA Kec.BATU CEPER Kota/Kab.TANGGERANG BANTEN BANTEN 00000",TIN,,,,8da10eef-ea32-45c5-9b82-febbabbb5658,
PT. Intrasindo,buyer,210403770407000,IDN,4,,PERUMAHAN HARAPAN BARU REGENCY Blok C No.1/9 RT:000 RW:000 Kel.KOTA BARU Kec.BEKASI BARAT Kota/Kab.BEKASI JAWA BARAT 17133,TIN,,,,8da10eef-ea32-45c5-9b82-febbabbb5658,
PT. Asia Megatama Sejahtera,buyer,723467627012000,IDN,4,,RUKO NEW JASMINE EXTENTION HA Blok - No.23 RT:000 RW:000 Kel.- Kec.GADING SERPONG Kota/Kab.TANGERANG - 00000,TIN,,,,8da10eef-ea32-45c5-9b82-febbabbb5658,
PT. Abc President Indonesia,buyer,10706414057000,IDN,4,,"EIGHTY EIGHT @KASABLANKA OFFICE TOWER A LT. 31 UNIT A-H, JL. CASABLANCA RAYA KAV 88 Blok 000 No.000 RT:016 RW:005 Kel.MENTENG DALAM Kec.TEBET Kota/Kab.JAKARTA SELATAN DKI JAKARTA 00000",TIN,,,,8da10eef-ea32-45c5-9b82-febbabbb5658,
PT. Unifoods Indonesia,buyer,21930151057000,IDN,4,,JL. JABABEKA IX KAWASAN INDUSTRI JABABEKA Blok E No.18-26 RT:000 RW:000 Kel.- Kec.CIKARANG Kota/Kab.BEKASI JAWA BARAT 17530,TIN,,,,8da10eef-ea32-45c5-9b82-febbabbb5658,
PT. Indesso Culinaroma Internasional,buyer,748084787436000,IDN,4,,JL. ALTERNATIF CIBUBUR KP PASAR Blok - No.- RT:001 RW:004 Kel.- Kec.- Kota/Kab.BOGOR JAWA BARAT 16820,TIN,,,,8da10eef-ea32-45c5-9b82-febbabbb5658,
PT. Neopangan Selaras Indonesia,buyer,316781871451000,IDN,4,,Komp Sentra Niaga Surya Kadu Blok I No.18 RT:001 RW:001 Kel.Kadujaya Kec.Curug Kota/Kab.Tangerang Banten 00000,TIN,,,,8da10eef-ea32-45c5-9b82-febbabbb5658,
PT. Wahana Citra Nabati,buyer,19199025046000,IDN,4,,"GEDUNG SUDIRMAN PLAZA, PLAZA MAREIN LANTAI 12, JL. JEND. SUDIRMAN KAV. 76-78 Blok - No.000 RT:000 RW:000 Kel.- Kec.SETIABUDI Kota/Kab.JAKARTA SELATAN DKI JAKARTA RAYA 12910",TIN,,,,8da10eef-ea32-45c5-9b82-febbabbb5658,
PT. Sarang Sari,buyer,13117569071000,IDN,4,,JL. CIKINI RAYA 77 Blok - No.- RT:000 RW:000 Kel.CIKINI Kec.MENTENG Kota/Kab.JAKARTA PUSAT DKI JAKARTA 10330,TIN,,,,8da10eef-ea32-45c5-9b82-febbabbb5658,
CV. Raton Food 999,buyer,811243922407000,IDN,4,,JL. PERJUANGAN Blok - No.28 RT:000 RW:000 Kel.- Kec.BEKASI UTARA Kota/Kab.BEKASI JAWA BARAT 00000,TIN,,,,8da10eef-ea32-45c5-9b82-febbabbb5658,
PT. Foodex Inti Ingredients,buyer,17135658431000,IDN,4,,JL. SOKA DELTA SILICON 3 LIPPO CIKARANG Blok F 18 No.11-12 RT:000 RW:000 Kel.CICAU Kec.CIKARANG PUSAT Kota/Kab.BEKASI JAWA BARAT 00000,TIN,,,,8da10eef-ea32-45c5-9b82-febbabbb5658,
PT. Karawang Foods Lestari,buyer,21656939413000,IDN,4,,"JL. KAPUK, DELTA SILICON III IND. PARK Blok F 19 No.9 RT:000 RW:000 Kel.CICAU Kec.CIKARANG PUSAT Kota/Kab.BEKASI JAWA BARAT 00000",TIN,,,,8da10eef-ea32-45c5-9b82-febbabbb5658,
PT. Antaran Sukses Mandiri,buyer,838104784416000,IDN,4,,JL RADEN FATAH Blok - No.10 RT:001 RW:001 Kel.- Kec.- Kota/Kab.TANGERANG - 00000,TIN,,,,8da10eef-ea32-45c5-9b82-febbabbb5658,
MUSTIKA ALAM LESTARI,buyer,21886361046000,IDN,4,,Jalan Bitung Ujung No.1 Pelabuhan Tanjung Priuk Blok - No.- RT:000 RW:000 Kel.- Kec.- Kota/Kab.Jakarta Utara DKI Jakarta 00000,TIN,,,,8da10eef-ea32-45c5-9b82-febbabbb5658,
PT. Lautan Natural Krimerindo,buyer,311922611602000,IDN,4,,"Jl. Raya Mojosari - Pacet KM.04, Pesanggrahan Blok - No.- RT:001 RW:001 Kel.Ketidur Kec.Kutorejo Kota/Kab.Mojokerto Jawa Timur 61383",TIN,,,,8da10eef-ea32-45c5-9b82-febbabbb5658,
PT. Jinyoung,buyer,20265849052000,IDN,4,,"KAW. INDUSTRI KLAPANUNGGAL KM.26,5 Blok - No.- RT:000 RW:000 Kel.KLAPANUNGGAL Kec.CILEUNGSI Kota/Kab.BOGOR JAWA BARAT 00000",TIN,,,,8da10eef-ea32-45c5-9b82-febbabbb5658,
PT. Sin A Sixfifteen,buyer,10713543059000,IDN,4,,"JL. REMBANG INDUSTRI, KAWASAN PIER PANDEAN REMBANG Blok I/30 No.000 RT:000 RW:000 Kel.- Kec.- Kota/Kab.PASURUAN JAWA TIMUR 67152",TIN,,,,8da10eef-ea32-45c5-9b82-febbabbb5658,
PT. Yupi Indo Jelly Gum,buyer,17036013431000,IDN,4,,JL. PANCASILA IV Blok - No.- RT:000 RW:000 Kel.CICADAS Kec.GUNUNG PUTRI Kota/Kab.BOGOR JAWA BARAT 00000,TIN,,,,8da10eef-ea32-45c5-9b82-febbabbb5658,
PT. Transworld Gls Indonesia,buyer,713009322043000,IDN,4,,GEDUNG KIRANA DUA LT 16 UNIT D JL. BOULEVARD TIMUR Blok - No.88 RT:005 RW:002 Kel.PEGANGSAAN DUA Kec.- Kota/Kab.JAKARTA UTARA - 00000,TIN,,,,8da10eef-ea32-45c5-9b82-febbabbb5658,
PT. Berkah Malindo Perkasa,buyer,818126583452000,IDN,4,,Jl. Raya Manis II 3 Multigudang Blok E No.11 RT:004 RW:001 Kel.Kadu Kec.Curug Kota/Kab.Tangerang Banten 15810,TIN,,,,8da10eef-ea32-45c5-9b82-febbabbb5658,
PT. Freyabadi Indotama,buyer,15112006431000,IDN,4,,JL. MALIGI III LOT J-2A KAWASAN INDUSTRI KIIC Blok - No.- RT:000 RW:000 Kel.TELUK RAMBE Kec.TELUK RAMBE Kota/Kab.KARAWANG - 41361,TIN,,,,8da10eef-ea32-45c5-9b82-febbabbb5658,
PT. Whakyung Aroma Creation,buyer,26049544018000,IDN,4,,"WISMA BUMIPUTERA LT.8, JL JEND SUDIRMAN KAV 75 Blok - No.- RT:000 RW:000 Kel.- Kec.- Kota/Kab.JAKARTA SELATAN - 12910",TIN,,,,8da10eef-ea32-45c5-9b82-febbabbb5658,
PT. Sinar Mulia Sukses Makmur,buyer,19634856011000,IDN,4,,"Mall Ambassador Lt. 3 No. 36, Jl. Prof. DR. Satrio Blok - No.- RT:000 RW:000 Kel.Kuningan Kec.Setiabudi Kota/Kab.Jakarta Selatan - 00000",TIN,,,,8da10eef-ea32-45c5-9b82-febbabbb5658,
PT. Kiantaka Rasa,buyer,14953160415000,IDN,4,,KP.Kadu Blok - No.- RT:006 RW:001 Kel.BUNDER Kec.CIKUPA Kota/Kab.TANGERANG BANTEN 15710,TIN,,,,8da10eef-ea32-45c5-9b82-febbabbb5658,
PT. Aroma Dinamis Sejahtera,buyer,946718244085000,IDN,4,,Green Sedayu Bizpark No. 16 Daan Mogot 10 Jl. Daan Mogot Raya KM 19 Blok - No.- RT:003 RW:008 Kel.- Kec.Kalideres Kota/Kab.Jakarta Barat - 11840,TIN,,,,8da10eef-ea32-45c5-9b82-febbabbb5658,
ADITHYA PRATAMA,buyer,743617060411001,IDN,4,,TAMAN TEKNO BSD SEKTOR XI Blok L-2 No.10 RT:000 RW:000 Kel.SETU Kec.SETU Kota/Kab.TANGERANG SELATAN BANTEN 00000,TIN,,,,8da10eef-ea32-45c5-9b82-febbabbb5658,
PT. Aroma Indonesia Internasional,buyer,823032842424000,IDN,4,,"JALAN TAMAN KOPO KATAPANG, C1, 10 Blok 0 No.00 RT:000 RW:000 Kel.PANGAUBAN Kec.KATAPANG Kota/Kab.BANDUNG JAWA BARAT 40921",TIN,,,,8da10eef-ea32-45c5-9b82-febbabbb5658,
PT. Natura Laboratoria Prima,buyer,19603174029000,IDN,4,,Jl. Kaji Blok 0 No.54 RT:008 RW:007 Kel.Petojo Utara Kec.Gambir Kota/Kab.Jakarta Pusat DKI Jakarta 00000,TIN,,,,8da10eef-ea32-45c5-9b82-febbabbb5658,
PT. Kharisma Prima Abadi,buyer,17570938542000,IDN,4,,JL. Kebon Agung Km.1 Blok 0 No.7 RT:000 RW:000 Kel.Sendangadi Kec.Mlati Kota/Kab.Sleman DI Yogyakarta 00000,TIN,,,,8da10eef-ea32-45c5-9b82-febbabbb5658,
PT. Cipta Selera Semesta,buyer,19810944415000,IDN,4,,KP. KRAMAT Blok 0 No.0 RT:000 RW:000 Kel.SUMUR BANDUNG Kec.JAYANTI Kota/Kab.TANGERANG BANTEN 15643,TIN,,,,8da10eef-ea32-45c5-9b82-febbabbb5658,
PT. Sumber Sejahtera Mandiri Industri,buyer,935236885452000,IDN,4,,KAWASAN PERGUDANGAN DAN INDUSTRI TUNAS BITUNG JALAN RAYA SERANG KM.13.8 Blok B.1 No.07 RT:000 RW:000 Kel.PASIR JAYA Kec.CIKUPA Kota/Kab.TANGERANG BANTEN 00000,TIN,,,,8da10eef-ea32-45c5-9b82-febbabbb5658,
PT. Foodindo Dwivestamas,buyer,21987417431000,IDN,4,,JL. INDUSTRI SELATAN IV KAWASAN INDUSTRI JABABEKA Blok GG-5G No.0 RT:000 RW:000 Kel.- Kec.- Kota/Kab.BEKASI JAWA BARAT 00000,TIN,,,,8da10eef-ea32-45c5-9b82-febbabbb5658,
PT. Dapur Cokelat,buyer,21844691411000,IDN,4,,JL. H NIBAN RIMIN Blok 0 No.99 RT:000 RW:000 Kel.BUARAN Kec.SERPONG Kota/Kab.TANGERANG SELATAN BANTEN 15310,TIN,,,,8da10eef-ea32-45c5-9b82-febbabbb5658,
SIAN SUMIRAN,buyer,945908374034000,IDN,4,,CENGKARENG TIMUR Blok 0 No.0 RT:010 RW:011 Kel.CENGKARENG TIMUR Kec.CENGKARENG Kota/Kab.JAKARTA BARAT DKI JAKARTA 00000,TIN,,,,8da10eef-ea32-45c5-9b82-febbabbb5658,
PT. Hon Chuan Indonesia,buyer,23121296052000,IDN,4,,"JL. KENARI, KAWASAN INDUSTRI DELTA SILICON V Blok - No.- RT:000 RW:000 Kel.CICAU Kec.CIKARANG PUSAT Kota/Kab.BEKASI JAWA BARAT 17530",TIN,,,,8da10eef-ea32-45c5-9b82-febbabbb5658,
PT. Perkebunan Nusantara Viii,buyer,10611341051000,IDN,4,,JL. Sindang Sirnano Blok - No.4 RT:000 RW:000 Kel.Sukasari Kec.sukasari Kota/Kab.Bandung - 00000,TIN,,,,8da10eef-ea32-45c5-9b82-febbabbb5658,
PT. Indofood Cbp Sukses Makmur Tbk,buyer,0029930856092000,IDN,4,,"Gedung Sudirman Plaza - Setiabudi, Kota ADM. Jakata Selatan DKI Jakarta, 12910",TIN,,,,8da10eef-ea32-45c5-9b82-febbabbb5658,
PT. Mitraboga Kreasi Prima,buyer,0729372888085000,IDN,4,,"Gedung OT, Jl. Lingkar Luar Barat Kav. 35-36 Rawa Buaya Cengkareng Jakarta Barat",TIN,,,,8da10eef-ea32-45c5-9b82-febbabbb5658,
PT. You Indonesia,buyer,0940041130011000,IDN,4,,"Gedung Millenium Centennial Centre Lt. 38, Jl. Jend. Sudirman Kav 25 RT.001 RW.001 Karet, Setiabudi Jakarta Selatan",TIN,,,,8da10eef-ea32-45c5-9b82-febbabbb5658,
PT. Sumber Rasa Nusantara Industri,buyer,0963412523047000,IDN,4,,Jl. Pantai Indah Barat Komplek Town Office Home Office (TOHO) Pantai Indah Kapuk Blok B No 20 Kamal Muara Penjaringan Jakut,TIN,,,,8da10eef-ea32-45c5-9b82-febbabbb5658,
PT. Komunitas Flavoria Indonesia,buyer,0614146488451000,IDN,4,,"Jl Daan Mogot KM 21 No 1 Pergudangan Eraprima Blok Q9 Batuceper, Tangerang 15122",TIN,,,,8da10eef-ea32-45c5-9b82-febbabbb5658,
PT. Sinar Sosro Gunung Slamat,buyer,0011076700511000,IDN,4,,"JL MAYJEN SUTOYO NO.28, RT 000, RW 000, SLAWI WETAN, SLAWI, KAB. TEGAL, JAWA TENGAH 52411",TIN,,,,8da10eef-ea32-45c5-9b82-febbabbb5658,